{
  "registry_version": "DAE-OMML-FORMULAS-1.0",
  "engine_version": "0.7.0-alpha.1",
  "generated_at": "2026-08-11T16:16:24Z",
  "source_id": "LOCAL-SHA256-B8EE307BEB056C56FBE2872CEF3E7319E14F8D4F7E1E9305055338F66084DED6",
  "formula_count": 0,
  "raw_formula_text_included": false,
  "formulas": [],
  "exact_formula_groups": [],
  "claim_ceiling": "FORMULA_STRUCTURE_AND_FIXITY_ONLY_NOT_MATHEMATICAL_INTERPRETATION"
}
